{
  "type": "object",
  "properties": {
    "protocolMajor": {
      "const": 1
    },
    "protocolMinor": {
      "type": "integer",
      "minimum": 0
    },
    "commandId": {
      "type": "string",
      "format": "uuid"
    },
    "transactionId": {
      "type": "string",
      "format": "uuid"
    },
    "projectId": {
      "type": "string",
      "format": "uuid"
    },
    "engineEpoch": {
      "type": "string",
      "format": "uuid"
    },
    "expectedRevision": {
      "type": "string",
      "pattern": "^(0|[1-9][0-9]*)$"
    },
    "operation": {
      "enum": [
        "project.create",
        "track.create",
        "clip.place",
        "clip.move",
        "clip.trim",
        "notes.insert",
        "parameter.set",
        "history.undo",
        "history.redo",
        "proposal.accept"
      ]
    },
    "payload": {
      "type": "object"
    }
  },
  "required": [
    "protocolMajor",
    "protocolMinor",
    "commandId",
    "transactionId",
    "projectId",
    "engineEpoch",
    "expectedRevision",
    "operation",
    "payload"
  ],
  "additionalProperties": false,
  "$schema": "https://json-schema.org/draft/2020-12/schema",
  "$id": "https://void.invalid/schemas/command/1.0.0",
  "title": "VOID initial persistent-mutation DTO",
  "description": "Semantic JSON boundary only. Int64 range, finite values, capability, parameter bounds and native binary verifier are mandatory runtime validations. .invalid ID is an identifier, not a hosted service.",
  "allOf": [
    {
      "if": {
        "properties": {
          "operation": {
            "const": "project.create"
          }
        },
        "required": [
          "operation"
        ]
      },
      "then": {
        "properties": {
          "payload": {
            "type": "object",
            "properties": {
              "name": {
                "type": "string",
                "minLength": 1,
                "maxLength": 200
              },
              "sampleRate": {
                "type": "integer",
                "minimum": 8000,
                "maximum": 384000
              }
            },
            "required": [
              "name",
              "sampleRate"
            ],
            "additionalProperties": false
          }
        }
      }
    },
    {
      "if": {
        "properties": {
          "operation": {
            "const": "track.create"
          }
        },
        "required": [
          "operation"
        ]
      },
      "then": {
        "properties": {
          "payload": {
            "type": "object",
            "properties": {
              "trackId": {
                "type": "string",
                "format": "uuid"
              },
              "name": {
                "type": "string",
                "minLength": 1,
                "maxLength": 200
              },
              "kind": {
                "enum": [
                  "audio",
                  "midi",
                  "instrument",
                  "bus"
                ]
              }
            },
            "required": [
              "trackId",
              "name",
              "kind"
            ],
            "additionalProperties": false
          }
        }
      }
    },
    {
      "if": {
        "properties": {
          "operation": {
            "const": "clip.place"
          }
        },
        "required": [
          "operation"
        ]
      },
      "then": {
        "properties": {
          "payload": {
            "type": "object",
            "properties": {
              "clipId": {
                "type": "string",
                "format": "uuid"
              },
              "trackId": {
                "type": "string",
                "format": "uuid"
              },
              "assetSha256": {
                "type": "string",
                "pattern": "^[a-f0-9]{64}$"
              },
              "startTick": {
                "type": "string",
                "pattern": "^-?(0|[1-9][0-9]*)$"
              },
              "durationTicks": {
                "type": "string",
                "pattern": "^[1-9][0-9]*$"
              }
            },
            "required": [
              "clipId",
              "trackId",
              "assetSha256",
              "startTick",
              "durationTicks"
            ],
            "additionalProperties": false
          }
        }
      }
    },
    {
      "if": {
        "properties": {
          "operation": {
            "const": "clip.move"
          }
        },
        "required": [
          "operation"
        ]
      },
      "then": {
        "properties": {
          "payload": {
            "type": "object",
            "properties": {
              "clipId": {
                "type": "string",
                "format": "uuid"
              },
              "trackId": {
                "type": "string",
                "format": "uuid"
              },
              "startTick": {
                "type": "string",
                "pattern": "^-?(0|[1-9][0-9]*)$"
              }
            },
            "required": [
              "clipId",
              "trackId",
              "startTick"
            ],
            "additionalProperties": false
          }
        }
      }
    },
    {
      "if": {
        "properties": {
          "operation": {
            "const": "clip.trim"
          }
        },
        "required": [
          "operation"
        ]
      },
      "then": {
        "properties": {
          "payload": {
            "type": "object",
            "properties": {
              "clipId": {
                "type": "string",
                "format": "uuid"
              },
              "sourceOffsetSamples": {
                "type": "string",
                "pattern": "^(0|[1-9][0-9]*)$"
              },
              "durationTicks": {
                "type": "string",
                "pattern": "^[1-9][0-9]*$"
              }
            },
            "required": [
              "clipId",
              "sourceOffsetSamples",
              "durationTicks"
            ],
            "additionalProperties": false
          }
        }
      }
    },
    {
      "if": {
        "properties": {
          "operation": {
            "const": "notes.insert"
          }
        },
        "required": [
          "operation"
        ]
      },
      "then": {
        "properties": {
          "payload": {
            "type": "object",
            "properties": {
              "trackId": {
                "type": "string",
                "format": "uuid"
              },
              "clipId": {
                "type": "string",
                "format": "uuid"
              },
              "notes": {
                "type": "array",
                "minItems": 1,
                "maxItems": 2000,
                "items": {
                  "type": "object",
                  "properties": {
                    "noteId": {
                      "type": "string",
                      "format": "uuid"
                    },
                    "startTick": {
                      "type": "string",
                      "pattern": "^-?(0|[1-9][0-9]*)$"
                    },
                    "durationTicks": {
                      "type": "string",
                      "pattern": "^[1-9][0-9]*$"
                    },
                    "pitch": {
                      "type": "integer",
                      "minimum": 0,
                      "maximum": 127
                    },
                    "velocity": {
                      "type": "number",
                      "minimum": 0,
                      "maximum": 1
                    }
                  },
                  "required": [
                    "noteId",
                    "startTick",
                    "durationTicks",
                    "pitch",
                    "velocity"
                  ],
                  "additionalProperties": false
                }
              }
            },
            "required": [
              "trackId",
              "clipId",
              "notes"
            ],
            "additionalProperties": false
          }
        }
      }
    },
    {
      "if": {
        "properties": {
          "operation": {
            "const": "parameter.set"
          }
        },
        "required": [
          "operation"
        ]
      },
      "then": {
        "properties": {
          "payload": {
            "type": "object",
            "properties": {
              "targetId": {
                "type": "string",
                "format": "uuid"
              },
              "parameterId": {
                "type": "string",
                "minLength": 1,
                "maxLength": 200
              },
              "value": {
                "type": "number"
              },
              "gestureTransactionEnd": {
                "type": "boolean"
              }
            },
            "required": [
              "targetId",
              "parameterId",
              "value",
              "gestureTransactionEnd"
            ],
            "additionalProperties": false
          }
        }
      }
    },
    {
      "if": {
        "properties": {
          "operation": {
            "const": "history.undo"
          }
        },
        "required": [
          "operation"
        ]
      },
      "then": {
        "properties": {
          "payload": {
            "type": "object",
            "properties": {
              "targetTransactionId": {
                "type": "string",
                "format": "uuid"
              }
            },
            "required": [
              "targetTransactionId"
            ],
            "additionalProperties": false
          }
        }
      }
    },
    {
      "if": {
        "properties": {
          "operation": {
            "const": "history.redo"
          }
        },
        "required": [
          "operation"
        ]
      },
      "then": {
        "properties": {
          "payload": {
            "type": "object",
            "properties": {
              "targetTransactionId": {
                "type": "string",
                "format": "uuid"
              }
            },
            "required": [
              "targetTransactionId"
            ],
            "additionalProperties": false
          }
        }
      }
    },
    {
      "if": {
        "properties": {
          "operation": {
            "const": "proposal.accept"
          }
        },
        "required": [
          "operation"
        ]
      },
      "then": {
        "properties": {
          "payload": {
            "type": "object",
            "properties": {
              "proposalId": {
                "type": "string",
                "format": "uuid"
              },
              "contextSha256": {
                "type": "string",
                "pattern": "^[a-f0-9]{64}$"
              },
              "selectedItemIds": {
                "type": "array",
                "minItems": 1,
                "maxItems": 2000,
                "uniqueItems": true,
                "items": {
                  "type": "string",
                  "format": "uuid"
                }
              }
            },
            "required": [
              "proposalId",
              "contextSha256",
              "selectedItemIds"
            ],
            "additionalProperties": false
          }
        }
      }
    }
  ]
}
